{
  "schema_version": "1.0.0",
  "kind": "catalog_bundle",
  "taxonomy_version": "1.0.0",
  "annotation_kit_version": "1.1.0",
  "catalog": {
    "catalog_id": "synthetic-valves",
    "source_file_name": "Синтетический прайс.xlsx",
    "source_sha256": "0000000000000000000000000000000000000000000000000000000000000000",
    "annotated_at": "2026-07-29T12:00:00Z",
    "item_count": 4
  },
  "items": [
    {
      "source": {
        "source_position": {
          "sheet": "Синтетический лист",
          "row": 2
        },
        "raw_name": "Синтетический кран шаровой",
        "supplier_sku": "SYN-VALVE-001",
        "gtin": null,
        "price": 540,
        "currency": "RUB",
        "stock_quantity": 10,
        "unit": "шт",
        "context": [
          "Синтетическая арматура"
        ],
        "raw_fields": {
          "Наименование": "Синтетический кран шаровой",
          "Цена": 540
        }
      },
      "catalog_item": {
        "annotation": {
          "ambiguities": [],
          "evidence": [
            {
              "json_pointer": "/class_id",
              "source_text": "synthetic evidence"
            },
            {
              "json_pointer": "/attributes/body_material",
              "source_text": "synthetic evidence"
            },
            {
              "json_pointer": "/attributes/handle_type",
              "source_text": "synthetic evidence"
            },
            {
              "json_pointer": "/ports/0/connection_kind",
              "source_text": "synthetic evidence"
            },
            {
              "json_pointer": "/ports/0/system",
              "source_text": "synthetic evidence"
            },
            {
              "json_pointer": "/ports/1/connection_kind",
              "source_text": "synthetic evidence"
            },
            {
              "json_pointer": "/ports/1/system",
              "source_text": "synthetic evidence"
            }
          ],
          "issues": [],
          "status": "validated",
          "unknown_fields": []
        },
        "attributes": {
          "body_material": "aluminum",
          "handle_type": "butterfly"
        },
        "class_id": "valve.ball",
        "identity": {
          "brand": null,
          "manufacturer": null,
          "manufacturer_articles": [],
          "models": [],
          "series": null
        },
        "ports": [
          {
            "connection_kind": "compression",
            "role": "inlet",
            "system": "hdpe"
          },
          {
            "connection_kind": "compression",
            "role": "outlet",
            "system": "hdpe"
          }
        ],
        "schema_version": "1.1.0",
        "source_item_id": "synthetic-valve.ball-1",
        "taxonomy_version": "1.0.0"
      }
    },
    {
      "source": {
        "source_position": {
          "sheet": "Синтетический лист",
          "row": 3
        },
        "raw_name": "Synthetic needs_review",
        "supplier_sku": "SYN-VALVE-001",
        "gtin": null,
        "price": 540,
        "currency": "RUB",
        "stock_quantity": 10,
        "unit": "шт",
        "context": [
          "Синтетическая арматура"
        ],
        "raw_fields": {
          "Наименование": "Синтетический кран шаровой",
          "Цена": 540
        }
      },
      "catalog_item": {
        "annotation": {
          "ambiguities": [],
          "evidence": [
            {
              "json_pointer": "/class_id",
              "source_text": "synthetic evidence"
            },
            {
              "json_pointer": "/attributes/body_material",
              "source_text": "synthetic evidence"
            },
            {
              "json_pointer": "/attributes/handle_type",
              "source_text": "synthetic evidence"
            },
            {
              "json_pointer": "/ports/0/connection_kind",
              "source_text": "synthetic evidence"
            },
            {
              "json_pointer": "/ports/0/system",
              "source_text": "synthetic evidence"
            },
            {
              "json_pointer": "/ports/1/connection_kind",
              "source_text": "synthetic evidence"
            },
            {
              "json_pointer": "/ports/1/system",
              "source_text": "synthetic evidence"
            }
          ],
          "issues": [
            {
              "code": "REVIEW_REQUIRED",
              "message": "Requires operator review"
            }
          ],
          "status": "needs_review",
          "unknown_fields": []
        },
        "attributes": {
          "body_material": "aluminum",
          "handle_type": "butterfly"
        },
        "class_id": "valve.ball",
        "identity": {
          "brand": null,
          "manufacturer": null,
          "manufacturer_articles": [],
          "models": [],
          "series": null
        },
        "ports": [
          {
            "connection_kind": "compression",
            "role": "inlet",
            "system": "hdpe"
          },
          {
            "connection_kind": "compression",
            "role": "outlet",
            "system": "hdpe"
          }
        ],
        "schema_version": "1.1.0",
        "source_item_id": "review-1",
        "taxonomy_version": "1.0.0"
      }
    },
    {
      "source": {
        "source_position": {
          "sheet": "Синтетический лист",
          "row": 3
        },
        "raw_name": "Synthetic invalid",
        "supplier_sku": "SYN-VALVE-001",
        "gtin": null,
        "price": 540,
        "currency": "RUB",
        "stock_quantity": 10,
        "unit": "шт",
        "context": [
          "Синтетическая арматура"
        ],
        "raw_fields": {
          "Наименование": "Синтетический кран шаровой",
          "Цена": 540
        }
      },
      "catalog_item": {
        "annotation": {
          "ambiguities": [],
          "evidence": [
            {
              "json_pointer": "/class_id",
              "source_text": "synthetic evidence"
            },
            {
              "json_pointer": "/attributes/body_material",
              "source_text": "synthetic evidence"
            },
            {
              "json_pointer": "/attributes/handle_type",
              "source_text": "synthetic evidence"
            },
            {
              "json_pointer": "/ports/0/connection_kind",
              "source_text": "synthetic evidence"
            },
            {
              "json_pointer": "/ports/0/system",
              "source_text": "synthetic evidence"
            },
            {
              "json_pointer": "/ports/1/connection_kind",
              "source_text": "synthetic evidence"
            },
            {
              "json_pointer": "/ports/1/system",
              "source_text": "synthetic evidence"
            }
          ],
          "issues": [
            {
              "code": "CONTRADICTORY_SOURCE",
              "message": "Contradictory source values"
            }
          ],
          "status": "invalid",
          "unknown_fields": []
        },
        "attributes": {
          "body_material": "aluminum",
          "handle_type": "butterfly"
        },
        "class_id": "valve.ball",
        "identity": {
          "brand": null,
          "manufacturer": null,
          "manufacturer_articles": [],
          "models": [],
          "series": null
        },
        "ports": [
          {
            "connection_kind": "compression",
            "role": "inlet",
            "system": "hdpe"
          },
          {
            "connection_kind": "compression",
            "role": "outlet",
            "system": "hdpe"
          }
        ],
        "schema_version": "1.1.0",
        "source_item_id": "invalid-1",
        "taxonomy_version": "1.0.0"
      }
    },
    {
      "source": {
        "source_position": {
          "sheet": "Синтетический лист",
          "row": 5
        },
        "raw_name": "Товар вне taxonomy",
        "supplier_sku": "SYN-VALVE-001",
        "gtin": null,
        "price": 540,
        "currency": "RUB",
        "stock_quantity": 10,
        "unit": "шт",
        "context": [
          "Синтетическая арматура"
        ],
        "raw_fields": {
          "Наименование": "Синтетический кран шаровой",
          "Цена": 540
        }
      },
      "catalog_item": {
        "schema_version": "1.1.0",
        "taxonomy_version": "1.0.0",
        "source_item_id": "unsupported-1",
        "annotation": {
          "status": "unsupported",
          "reason_code": "NO_TAXONOMY_CLASS"
        }
      }
    }
  ]
}
